{
  "$schema": "https://json-schema.org/draft/2020-12/schema",
  "$id": "https://pocket-stack.dev/schema/pocket-2.json",
  "title": "Pocket application manifest, format 2",
  "type": "object",
  "additionalProperties": false,
  "required": [
    "$schema",
    "pocket",
    "id",
    "name",
    "title",
    "version",
    "engine",
    "app"
  ],
  "properties": {
    "$schema": {
      "const": "https://pocket-stack.dev/schema/pocket-2.json"
    },
    "pocket": {
      "const": 2
    },
    "id": {
      "type": "string",
      "minLength": 3,
      "pattern": "^[a-z0-9](?:[a-z0-9-]*[a-z0-9])?(?:\\.[a-z0-9](?:[a-z0-9-]*[a-z0-9])?)+$"
    },
    "name": {
      "type": "string",
      "minLength": 1,
      "maxLength": 64,
      "pattern": "^[a-z][a-z0-9]*(?:-[a-z0-9]+)*$"
    },
    "title": {
      "type": "string",
      "minLength": 1,
      "maxLength": 128
    },
    "version": {
      "type": "string",
      "pattern": "^(0|[1-9][0-9]*)\\.(0|[1-9][0-9]*)\\.(0|[1-9][0-9]*)(?:-[0-9A-Za-z-]+(?:\\.[0-9A-Za-z-]+)*)?(?:\\+[0-9A-Za-z-]+(?:\\.[0-9A-Za-z-]+)*)?$"
    },
    "engine": {
      "type": "object",
      "additionalProperties": false,
      "required": [
        "abi",
        "capabilities"
      ],
      "properties": {
        "abi": {
          "type": "integer",
          "minimum": 1
        },
        "capabilities": {
          "type": "object",
          "additionalProperties": false,
          "required": [
            "requires"
          ],
          "properties": {
            "requires": {
              "type": "array",
              "items": {
                "type": "object",
                "additionalProperties": false,
                "required": [
                  "id",
                  "version"
                ],
                "properties": {
                  "id": {
                    "type": "string",
                    "pattern": "^[a-z][a-z0-9-]*(?:\\.[a-z][a-z0-9-]*)+$"
                  },
                  "version": {
                    "type": "integer",
                    "minimum": 1
                  },
                  "parameters": {
                    "type": "object",
                    "additionalProperties": {
                      "anyOf": [
                        {
                          "type": "boolean"
                        },
                        {
                          "type": "number"
                        },
                        {
                          "type": "string"
                        }
                      ]
                    }
                  }
                }
              },
              "minItems": 1,
              "uniqueItems": true
            },
            "enhances": {
              "type": "array",
              "items": {
                "type": "object",
                "additionalProperties": false,
                "required": [
                  "id",
                  "version"
                ],
                "properties": {
                  "id": {
                    "type": "string",
                    "pattern": "^[a-z][a-z0-9-]*(?:\\.[a-z][a-z0-9-]*)+$"
                  },
                  "version": {
                    "type": "integer",
                    "minimum": 1
                  },
                  "parameters": {
                    "type": "object",
                    "additionalProperties": {
                      "anyOf": [
                        {
                          "type": "boolean"
                        },
                        {
                          "type": "number"
                        },
                        {
                          "type": "string"
                        }
                      ]
                    }
                  }
                }
              },
              "uniqueItems": true
            }
          }
        }
      }
    },
    "app": {
      "type": "object",
      "additionalProperties": false,
      "required": [
        "entry",
        "framework",
        "simulationHz",
        "viewport"
      ],
      "properties": {
        "entry": {
          "type": "string",
          "minLength": 1,
          "pattern": "^(?!/)(?!.*(?:^|/)\\.\\.(?:/|$))(?!.*\\\\).+\\.tsx?$"
        },
        "framework": {
          "enum": [
            "solid",
            "vue-vapor"
          ]
        },
        "simulationHz": {
          "type": "integer",
          "minimum": 1,
          "maximum": 240
        },
        "viewport": {
          "type": "object",
          "additionalProperties": false,
          "required": [
            "logical",
            "presentation"
          ],
          "properties": {
            "logical": {
              "type": "array",
              "items": {
                "type": "integer",
                "minimum": 1
              },
              "minItems": 2,
              "maxItems": 2
            },
            "presentation": {
              "enum": [
                "fill",
                "fit",
                "integer-fit",
                "native",
                "stretch"
              ]
            }
          }
        }
      }
    },
    "packages": {
      "type": "object",
      "additionalProperties": false,
      "properties": {
        "psp": {
          "type": "object",
          "additionalProperties": false,
          "properties": {
            "title": {
              "type": "string",
              "minLength": 1,
              "maxLength": 128
            },
            "icon0": {
              "type": "string",
              "minLength": 1,
              "pattern": "^(?!/)(?!.*(?:^|/)\\.\\.(?:/|$))(?!.*\\\\).+\\.png$"
            },
            "pic1": {
              "type": "string",
              "minLength": 1,
              "pattern": "^(?!/)(?!.*(?:^|/)\\.\\.(?:/|$))(?!.*\\\\).+\\.png$"
            },
            "memoryBudgetMb": {
              "type": "integer",
              "minimum": 1
            }
          }
        }
      }
    }
  }
}
